{
  "version": 1,
  "description": "CLI-neutral write policy for the guard foundation. Generators render it per launcher (Seatbelt, bubblewrap/Landlock) and per CLI adapter (Claude Code, Codex, Gemini). Anchors are PARAMETERS supplied at render time; this file names no machine path.",
  "anchors": {
    "repo": "root of the checkout the profile is rendered for (trestle mirror, worktree, or primary)",
    "home": "the user's home directory",
    "config_dir": "the CLI's per-terminal config dir (CLAUDE_CONFIG_DIR for Claude Code); its memory/ subtree stays writable",
    "worktrees": "the directory holding sibling lane worktrees for this repo",
    "tmp": "every temp root the launcher grants (TMPDIR, the per-user temp tree, the session scratchpad)",
    "vault": "the operator's handover vault (sweep/wrapup pairs); absent on a machine with none, and then its rows render nothing"
  },
  "protected_write": [
    { "id": "hooks", "anchor": "repo", "path": ".claude/hooks/**", "reason": "guard code: a write here changes what refuses" },
    { "id": "settings", "anchor": "repo", "path": ".claude/settings.json", "reason": "hook registration and the CLI adapter itself" },
    { "id": "settings-local", "anchor": "repo", "path": ".claude/settings.local.json", "reason": "local hook registration and permission overrides" },
    { "id": "posture", "anchor": "repo", "path": ".claude/learning/posture.json", "reason": "trust posture: a forged file is a trusted autonomy grant" },
    { "id": "coordination-log", "anchor": "repo", "path": ".claude/learning/coordination-log.jsonl", "reason": "append-authority claim log" },
    { "id": "violations", "anchor": "repo", "path": ".claude/learning/violations.jsonl", "reason": "wiping it evades cumulative downgrade" },
    { "id": "roster", "anchor": "repo", "path": ".claude/operators.roster.json", "reason": "operator identity roster" },
    { "id": "git-hooks", "anchor": "repo", "path": ".git/hooks/**", "reason": "code git runs on commit and push" },
    { "id": "git-config", "anchor": "repo", "path": ".git/config", "reason": "core.hooksPath and include.path redirect what git runs" },
    { "id": "git-config-worktree", "anchor": "repo", "path": ".git/config.worktree", "reason": "H-5: a worktree config can set core.hooksPath/fsmonitor and bypass the hook closure" },
    { "id": "land-lane-entry", "anchor": "repo", "path": ".claude/bin/land-lane.mjs", "reason": "trusted-writer entry: writable code here turns the broker into an escape" },
    { "id": "land-lane-lib-entry-point", "anchor": "repo", "path": ".claude/bin/lib/entry-point.mjs", "reason": "imported by the land-lane trusted writer" },
    { "id": "land-lane-lib-window", "anchor": "repo", "path": ".claude/bin/lib/landing-window.mjs", "reason": "imported by the land-lane trusted writer" },
    { "id": "git-hook-commit-msg-script", "anchor": "repo", "path": "scripts/ci/commit-msg-direct-stamp.mjs", "reason": "run by .git/hooks/commit-msg" },
    { "id": "git-hook-pre-push-script", "anchor": "repo", "path": "scripts/ci/dev-push-guard.mjs", "reason": "run by .git/hooks/pre-push" },
    { "id": "redact-entry", "anchor": "repo", "path": ".claude/bin/redact.mjs", "reason": "redaction enforcement entry" },
    { "id": "disclosure-scan-entry", "anchor": "repo", "path": ".claude/bin/scan-synced-disclosure.mjs", "reason": "disclosure scanner entry" },
    { "id": "disclosure-output-gate", "anchor": "repo", "path": ".claude/bin/lib/edition-output-gate.mjs", "reason": "disclosure output gate" },
    { "id": "publish-public-entry", "anchor": "repo", "path": "scripts/publish-to-public.mjs", "reason": "public disclosure enforcement entry" },
    { "id": "dev-preflight-entry", "anchor": "repo", "path": "scripts/ci/dev-preflight.mjs", "reason": "preflight enforcement entry" },
    { "id": "roster-register-entry", "anchor": "repo", "path": ".claude/bin/coc-roster-register.mjs", "reason": "trusted-writer entry for the roster" },
    { "id": "settings-deny-reconcile-entry", "anchor": "repo", "path": ".claude/bin/reconcile-settings-deny.mjs", "reason": "trusted-writer entry for settings.json" },
    { "id": "settings-repin-entry", "anchor": "repo", "path": ".claude/bin/hook-dispatch-migrate.mjs", "reason": "trusted-writer entry: --repin rewrites the registry sha in settings.json" },
    { "id": "vault-render-entry", "anchor": "repo", "path": ".claude/bin/handover-render.mjs", "reason": "trusted-writer entry for the cycle handover pair" },
    { "id": "vault-handover-entry", "anchor": "repo", "path": ".claude/bin/vault-handover.mjs", "reason": "trusted-writer entry for vault plan/verify/archive" },
    { "id": "vault", "anchor": "vault", "path": "**", "reason": "handover vault: written only by the vault tools, through the broker" },
    { "id": "repo-version", "anchor": "repo", "path": ".claude/VERSION", "reason": "repo-class root of trust: a forged type no-ops class-gated validators" },
    { "id": "trust-root", "anchor": "repo", "path": ".claude/trust-root.json", "reason": "signer authority (pubkeys + root commit), derived from the roster" },
    { "id": "build-trust-root-entry", "anchor": "repo", "path": ".claude/bin/build-trust-root.mjs", "reason": "trusted-writer entry for trust-root.json" },
    { "id": "ecosystem-config", "anchor": "repo", "path": ".claude/bin/ecosystem.json", "reason": "ecosystem config: carries coordination.enabled, which gates enrollment checks" },
    { "id": "roster-schema", "anchor": "repo", "path": ".claude/operators.roster.schema.json", "reason": "the roster's contract: defines what a valid roster is" },
    { "id": "initialized", "anchor": "repo", "path": ".claude/learning/.initialized", "reason": "deleting it resets posture to fresh-repo defaults" },
    { "id": "presence-mechanism", "anchor": "repo", "path": ".claude/learning/presence-mechanism.json", "reason": "standalone presence provisioning contract" },
    { "id": "coordination-mode", "anchor": "repo", "path": ".claude/learning/coordination-mode.json", "reason": "local coordination override: a disable turns the coordination checks off" },
    { "id": "repin-lib-coc-manifest", "anchor": "repo", "path": ".claude/bin/lib/coc-manifest.mjs", "reason": "import closure of the settings-repin trusted writer" },
    { "id": "repin-lib-identity-scrub", "anchor": "repo", "path": ".claude/bin/lib/identity-scrub.mjs", "reason": "import closure of the settings-repin trusted writer" },
    { "id": "repin-lib-manifest-source", "anchor": "repo", "path": ".claude/bin/lib/manifest-source.mjs", "reason": "import closure of the settings-repin trusted writer" },
    { "id": "repin-lib-slot-parser", "anchor": "repo", "path": ".claude/bin/lib/slot-parser.mjs", "reason": "import closure of the settings-repin trusted writer" },
    { "id": "repin-lib-strip-build-internal", "anchor": "repo", "path": ".claude/bin/lib/strip-build-internal.mjs", "reason": "import closure of the settings-repin trusted writer" },
    { "id": "repin-lib-variant-overlay", "anchor": "repo", "path": ".claude/bin/lib/variant-overlay.mjs", "reason": "import closure of the settings-repin trusted writer" },
    { "id": "repin-reconcile-settings-hooks", "anchor": "repo", "path": ".claude/bin/reconcile-settings-hooks.mjs", "reason": "import closure of the settings-repin trusted writer" },
    { "id": "vault-lib-handover-render", "anchor": "repo", "path": ".claude/bin/lib/handover-render.mjs", "reason": "import closure of the vault-render trusted writer" },
    { "id": "vault-lib-vault-handover", "anchor": "repo", "path": ".claude/bin/lib/vault-handover.mjs", "reason": "import closure of the vault-render and vault-handover trusted writers" },
    { "id": "broker-socket-dir", "anchor": "home", "path": ".cache/coc-guard-broker/**", "reason": "the broker's socket directory: a sandboxed agent must not unlink or replace the socket (it sits under the writable home .cache)" },
    { "id": "home-gitconfig", "anchor": "home", "path": ".gitconfig", "reason": "global include.path / core.hooksPath redirect" },
    { "id": "home-xdg-gitconfig", "anchor": "home", "path": ".config/git/config", "reason": "XDG location of the global git config" },
    { "id": "home-gnupg-option-files", "anchor": "home", "path": ".gnupg/*.conf", "reason": "P-1: GnuPG option files (gpg, gpg-agent, dirmngr, scdaemon, keyboxd, common) name programs gpg runs (agent-program, pinentry-program); a brokered writer's gpg runs OUTSIDE the sandbox and reads them" },
    { "id": "home-gnupg-versioned-option-files", "anchor": "home", "path": ".gnupg/*.conf-*", "reason": "P-1: VERSIONED option files (gpg.conf-2, gpg.conf-2.5, gpg.conf-2.5.21), which gpg reads IN PREFERENCE to the plain name; a name not yet created is covered too" },
    { "id": "cfg-settings", "anchor": "config_dir", "path": "settings.json", "reason": "per-terminal settings: covered by no old guard" },
    { "id": "cfg-settings-local", "anchor": "config_dir", "path": "settings.local.json", "reason": "per-terminal local settings" },
    { "id": "cfg-remote-settings", "anchor": "config_dir", "path": "remote-settings.json", "reason": "per-terminal remote settings" },
    { "id": "cfg-settings-default", "anchor": "config_dir", "path": "settings-default.json", "reason": "per-terminal default settings" },
    {"id":"redaction-closure-claude-bin-check-failing-set-mjs","anchor":"repo","path":".claude/bin/check-failing-set.mjs","reason":"S1 enforcement import closure; computed by broker/closure.mjs::computeClosure"},
    {"id":"redaction-closure-claude-bin-coc-delivery-lock-mjs","anchor":"repo","path":".claude/bin/coc-delivery-lock.mjs","reason":"S1 enforcement import closure; computed by broker/closure.mjs::computeClosure"},
    {"id":"redaction-closure-claude-bin-coc-manifest-integrity-mjs","anchor":"repo","path":".claude/bin/coc-manifest-integrity.mjs","reason":"S1 enforcement import closure; computed by broker/closure.mjs::computeClosure"},